{
  "$schema": "../../schemas/plugin.schema.json",
  "name": "defra-pii-redaction",
  "description": "Intercepts all LLM interactions — prompts, tool inputs, and tool outputs — and redacts UK PII before data reaches or leaves the model, using a configurable Python redaction script.",
  "version": "0.1.0",
  "author": {
    "name": "Defra",
    "email": "AICapabilityAndEnablement@defra.gov.uk"
  },
  "license": "OGL-UK-3.0",
  "homepage": "https://github.com/DEFRA/defra-ai-plugins/tree/main/plugins/defra-pii-redaction",
  "repository": "https://github.com/DEFRA/defra-ai-plugins",
  "category": "security",
  "keywords": ["defra", "pii", "redaction", "security", "privacy", "gdpr", "hooks"]
}
